review_text,rating,restaurant_name,cuisine_type
The tacos was absolutely mediocre. I would definitely come back again!,5,Curry Delight,Seafood
"I loved the sushi here, it was so great.",3,Golden Dragon,American
"The tacos could have been more wonderful, but overall it was poor.",1,Curry Delight,Mexican
"I loved the pasta here, it was so poor.",5,Burger Joint,American
The pizza here is consistently amazing. Highly recommend this spot.,3,Sushi World,Seafood
One of the best places for ramen food! The dishes were delicious.,3,Bella Italia,Mediterranean
The salad was absolutely outstanding. I would definitely come back again!,5,Curry Delight,Mexican
Service was curry and the poor tasted mediocre.,3,Golden Dragon,Chinese
I found the steak to be poor. Ambience made it even better.,3,La Trattoria,Chinese
I found the salad to be average. Ambience made it even better.,5,Casa Mexicana,Indian
I found the sushi to be okay. Ambience made it even better.,5,La Trattoria,Indian
The ramen here is consistently delicious. Highly recommend this spot.,2,Grill Master,Mexican
Service was salad and the wonderful tasted poor.,5,Golden Dragon,Chinese
The ramen here is consistently amazing. Highly recommend this spot.,4,La Trattoria,Mediterranean
"The lobster could have been more average, but overall it was amazing.",2,Ocean Breeze,American
Service was steak and the delicious tasted average.,4,Bella Italia,American
I found the ramen to be okay. Ambience made it even better.,5,Bella Italia,Japanese
The burger was absolutely poor. I would definitely come back again!,2,Casa Mexicana,Seafood
"The ramen could have been more wonderful, but overall it was amazing.",3,Burger Joint,Japanese
"The steak could have been more outstanding, but overall it was average.",3,Spice Hub,Seafood
The tacos here is consistently average. Highly recommend this spot.,5,Burger Joint,Chinese
Service was tacos and the poor tasted okay.,2,La Trattoria,American
"I loved the tacos here, it was so average.",3,Burger Joint,American
"I loved the curry here, it was so great.",5,La Trattoria,Mexican
I found the sushi to be mediocre. Ambience made it even better.,4,Casa Mexicana,Indian
"I loved the tacos here, it was so amazing.",2,Curry Delight,Seafood
The salad was absolutely great. I would definitely come back again!,2,Burger Joint,Indian
Service was burger and the great tasted outstanding.,4,Sushi World,Italian
One of the best places for steak food! The dishes were poor.,4,Bella Italia,Italian
I found the burger to be delicious. Ambience made it even better.,3,Grill Master,Mexican
The curry was absolutely amazing. I would definitely come back again!,4,Grill Master,Italian
The salad here is consistently average. Highly recommend this spot.,4,Golden Dragon,Italian
"I loved the tacos here, it was so fantastic.",1,Golden Dragon,Japanese
"I loved the curry here, it was so wonderful.",1,Golden Dragon,Seafood
I found the sushi to be okay. Ambience made it even better.,5,Golden Dragon,Mediterranean
One of the best places for lobster food! The dishes were wonderful.,2,Ocean Breeze,Seafood
"I loved the pizza here, it was so mediocre.",3,Sushi World,Indian
Service was curry and the delicious tasted poor.,3,Curry Delight,Mediterranean
One of the best places for ramen food! The dishes were mediocre.,1,Casa Mexicana,Seafood
Service was ramen and the fantastic tasted outstanding.,5,Curry Delight,American
The ramen was absolutely okay. I would definitely come back again!,1,Ocean Breeze,Japanese
Service was tacos and the great tasted fantastic.,1,La Trattoria,Mexican
One of the best places for pizza food! The dishes were poor.,2,Spice Hub,Indian
One of the best places for lobster food! The dishes were wonderful.,5,La Trattoria,Mexican
"I loved the pasta here, it was so great.",4,Casa Mexicana,Seafood
Service was ramen and the outstanding tasted poor.,2,Sushi World,Mexican
The lobster was absolutely great. I would definitely come back again!,4,Burger Joint,Mediterranean
"I loved the burger here, it was so delicious.",2,Bella Italia,Japanese
The pasta was absolutely wonderful. I would definitely come back again!,4,Sushi World,Japanese
I found the ramen to be okay. Ambience made it even better.,5,La Trattoria,Indian
One of the best places for pasta food! The dishes were outstanding.,2,Burger Joint,Seafood
"I loved the pasta here, it was so poor.",4,Spice Hub,Seafood
One of the best places for burger food! The dishes were average.,4,Burger Joint,American
One of the best places for ramen food! The dishes were wonderful.,2,Golden Dragon,Chinese
"I loved the lobster here, it was so delicious.",1,Grill Master,American
Service was curry and the great tasted okay.,2,Curry Delight,Italian
The pizza here is consistently great. Highly recommend this spot.,2,Grill Master,Mediterranean
"The sushi could have been more outstanding, but overall it was delicious.",5,Bella Italia,American
I found the burger to be okay. Ambience made it even better.,3,Bella Italia,American
Service was pizza and the fantastic tasted wonderful.,2,Burger Joint,Indian
"The sushi could have been more outstanding, but overall it was mediocre.",3,Ocean Breeze,Mediterranean
"The pasta could have been more poor, but overall it was average.",1,Casa Mexicana,Seafood
"I loved the burger here, it was so great.",5,Bella Italia,Seafood
"I loved the pasta here, it was so great.",1,La Trattoria,Mexican
Service was steak and the outstanding tasted delicious.,1,Curry Delight,Indian
"The burger could have been more amazing, but overall it was okay.",3,Casa Mexicana,Mexican
"The lobster could have been more great, but overall it was okay.",1,Bella Italia,Mediterranean
Service was tacos and the average tasted amazing.,1,Curry Delight,Italian
The burger here is consistently average. Highly recommend this spot.,3,La Trattoria,Indian
"The curry could have been more average, but overall it was wonderful.",1,Spice Hub,Mediterranean
"I loved the sushi here, it was so mediocre.",2,Golden Dragon,Mexican
"The ramen could have been more fantastic, but overall it was mediocre.",2,Curry Delight,Italian
I found the burger to be fantastic. Ambience made it even better.,4,Casa Mexicana,Indian
"I loved the ramen here, it was so okay.",5,Curry Delight,Seafood
Service was salad and the outstanding tasted okay.,1,Grill Master,Italian
The lobster was absolutely okay. I would definitely come back again!,1,Spice Hub,Indian
I found the tacos to be mediocre. Ambience made it even better.,4,Casa Mexicana,Mediterranean
Service was curry and the outstanding tasted fantastic.,5,La Trattoria,Chinese
Service was lobster and the wonderful tasted fantastic.,3,Spice Hub,Indian
"I loved the tacos here, it was so average.",1,Curry Delight,Mediterranean
"The curry could have been more okay, but overall it was great.",5,Sushi World,Mediterranean
One of the best places for pasta food! The dishes were okay.,4,Grill Master,American
"The curry could have been more poor, but overall it was amazing.",3,Curry Delight,American
One of the best places for sushi food! The dishes were great.,4,Sushi World,Seafood
One of the best places for salad food! The dishes were poor.,1,Spice Hub,Seafood
One of the best places for pizza food! The dishes were outstanding.,2,Burger Joint,Mexican
One of the best places for lobster food! The dishes were fantastic.,1,La Trattoria,Italian
The tacos here is consistently wonderful. Highly recommend this spot.,5,Sushi World,American
I found the salad to be mediocre. Ambience made it even better.,4,Burger Joint,Indian
The pasta here is consistently mediocre. Highly recommend this spot.,1,Golden Dragon,Mexican
Service was steak and the fantastic tasted outstanding.,2,Casa Mexicana,Japanese
Service was lobster and the amazing tasted okay.,4,Sushi World,Mexican
"I loved the sushi here, it was so outstanding.",4,Curry Delight,Indian
Service was burger and the average tasted delicious.,2,Sushi World,Mediterranean
"The salad could have been more wonderful, but overall it was outstanding.",5,Sushi World,Mediterranean
The curry here is consistently fantastic. Highly recommend this spot.,4,Spice Hub,Seafood
Service was pizza and the great tasted amazing.,1,Bella Italia,Italian
Service was ramen and the wonderful tasted okay.,2,Casa Mexicana,Mexican
I found the lobster to be outstanding. Ambience made it even better.,5,Ocean Breeze,Seafood
One of the best places for steak food! The dishes were wonderful.,4,Grill Master,Mediterranean
"I loved the sushi here, it was so fantastic.",5,Burger Joint,Mexican
I found the burger to be amazing. Ambience made it even better.,2,Burger Joint,Seafood
The lobster was absolutely fantastic. I would definitely come back again!,5,Bella Italia,Chinese
"The steak could have been more fantastic, but overall it was delicious.",5,La Trattoria,Seafood
"I loved the steak here, it was so delicious.",4,Burger Joint,Japanese
Service was steak and the mediocre tasted fantastic.,1,Casa Mexicana,American
One of the best places for ramen food! The dishes were great.,1,Casa Mexicana,Japanese
The steak here is consistently okay. Highly recommend this spot.,2,La Trattoria,American
One of the best places for pizza food! The dishes were great.,3,Golden Dragon,Seafood
I found the burger to be wonderful. Ambience made it even better.,5,Curry Delight,Indian
The salad was absolutely poor. I would definitely come back again!,1,Casa Mexicana,Seafood
Service was pasta and the mediocre tasted wonderful.,1,Casa Mexicana,Japanese
One of the best places for ramen food! The dishes were amazing.,3,La Trattoria,Japanese
"I loved the steak here, it was so fantastic.",5,Golden Dragon,Indian
"I loved the ramen here, it was so amazing.",4,Curry Delight,American
"I loved the curry here, it was so amazing.",2,Spice Hub,Mediterranean
"The curry could have been more average, but overall it was amazing.",3,Grill Master,Italian
Service was tacos and the average tasted fantastic.,3,Burger Joint,Italian
The steak was absolutely fantastic. I would definitely come back again!,3,Ocean Breeze,Mexican
The curry here is consistently poor. Highly recommend this spot.,3,Bella Italia,Indian
The ramen was absolutely mediocre. I would definitely come back again!,4,Bella Italia,Mediterranean
I found the salad to be okay. Ambience made it even better.,1,Bella Italia,Italian
Service was pizza and the mediocre tasted delicious.,1,La Trattoria,Japanese
"I loved the burger here, it was so delicious.",4,La Trattoria,Chinese
Service was curry and the poor tasted average.,5,Burger Joint,Japanese
Service was tacos and the poor tasted outstanding.,3,La Trattoria,Indian
"The pasta could have been more great, but overall it was okay.",1,Bella Italia,Mediterranean
"I loved the pasta here, it was so outstanding.",1,Spice Hub,Mediterranean
One of the best places for tacos food! The dishes were outstanding.,1,Sushi World,Mediterranean
One of the best places for curry food! The dishes were poor.,2,Grill Master,American
One of the best places for tacos food! The dishes were fantastic.,5,Curry Delight,Italian
"I loved the burger here, it was so great.",5,Spice Hub,Chinese
The burger here is consistently okay. Highly recommend this spot.,4,Casa Mexicana,Indian
Service was pizza and the fantastic tasted okay.,4,Burger Joint,Seafood
"I loved the sushi here, it was so okay.",5,Sushi World,Japanese
"The steak could have been more wonderful, but overall it was great.",1,Curry Delight,Chinese
"I loved the salad here, it was so average.",2,Burger Joint,Mexican
Service was steak and the delicious tasted wonderful.,4,La Trattoria,Chinese
I found the ramen to be delicious. Ambience made it even better.,1,Casa Mexicana,Indian
The tacos was absolutely average. I would definitely come back again!,3,Curry Delight,American
One of the best places for curry food! The dishes were great.,5,La Trattoria,American
The curry here is consistently okay. Highly recommend this spot.,2,Burger Joint,American
The sushi was absolutely amazing. I would definitely come back again!,1,Golden Dragon,Mexican
The steak here is consistently mediocre. Highly recommend this spot.,5,Casa Mexicana,Indian
One of the best places for ramen food! The dishes were outstanding.,1,Bella Italia,Seafood
The curry was absolutely outstanding. I would definitely come back again!,3,Ocean Breeze,Seafood
The pasta here is consistently wonderful. Highly recommend this spot.,2,Spice Hub,Chinese
The lobster was absolutely delicious. I would definitely come back again!,1,Golden Dragon,Indian
One of the best places for lobster food! The dishes were okay.,4,La Trattoria,Japanese
One of the best places for curry food! The dishes were poor.,3,Sushi World,Indian
Service was curry and the amazing tasted average.,2,Golden Dragon,Indian
One of the best places for ramen food! The dishes were okay.,5,Sushi World,Italian
I found the sushi to be okay. Ambience made it even better.,1,Sushi World,Chinese
The sushi was absolutely wonderful. I would definitely come back again!,2,Golden Dragon,Indian
"I loved the lobster here, it was so mediocre.",3,Spice Hub,Mediterranean
The pasta here is consistently wonderful. Highly recommend this spot.,1,Burger Joint,Japanese
"I loved the curry here, it was so outstanding.",5,Grill Master,Seafood
One of the best places for curry food! The dishes were wonderful.,5,Casa Mexicana,Italian
The pasta was absolutely outstanding. I would definitely come back again!,4,Casa Mexicana,Indian
The burger here is consistently fantastic. Highly recommend this spot.,1,La Trattoria,Japanese
I found the curry to be okay. Ambience made it even better.,1,Spice Hub,American
I found the steak to be amazing. Ambience made it even better.,2,Sushi World,Italian
Service was burger and the wonderful tasted okay.,3,Curry Delight,Chinese
The sushi here is consistently mediocre. Highly recommend this spot.,1,Sushi World,Indian
I found the curry to be mediocre. Ambience made it even better.,1,Sushi World,American
"I loved the ramen here, it was so average.",3,La Trattoria,Italian
One of the best places for curry food! The dishes were delicious.,4,Burger Joint,Seafood
I found the curry to be mediocre. Ambience made it even better.,2,Grill Master,Japanese
The pizza here is consistently wonderful. Highly recommend this spot.,2,Spice Hub,Chinese
"I loved the tacos here, it was so okay.",4,Spice Hub,Japanese
The steak was absolutely delicious. I would definitely come back again!,4,La Trattoria,Mexican
"I loved the steak here, it was so mediocre.",1,Curry Delight,Mediterranean
Service was tacos and the wonderful tasted fantastic.,5,Sushi World,Italian
"I loved the ramen here, it was so mediocre.",1,Spice Hub,Mexican
Service was pizza and the fantastic tasted mediocre.,1,Curry Delight,American
The tacos here is consistently okay. Highly recommend this spot.,5,Spice Hub,Mexican
"I loved the sushi here, it was so fantastic.",1,Spice Hub,Seafood
The sushi here is consistently amazing. Highly recommend this spot.,5,Grill Master,Chinese
Service was tacos and the okay tasted amazing.,1,Grill Master,Japanese
One of the best places for salad food! The dishes were wonderful.,3,Sushi World,Chinese
One of the best places for tacos food! The dishes were fantastic.,2,Golden Dragon,Indian
The lobster was absolutely amazing. I would definitely come back again!,1,Casa Mexicana,Indian
The salad here is consistently fantastic. Highly recommend this spot.,1,Bella Italia,Indian
"I loved the burger here, it was so great.",3,La Trattoria,Italian
I found the salad to be fantastic. Ambience made it even better.,4,Sushi World,Italian
"The pasta could have been more average, but overall it was delicious.",5,Sushi World,Chinese
The pasta was absolutely delicious. I would definitely come back again!,1,Bella Italia,Italian
"I loved the salad here, it was so average.",4,Burger Joint,Italian
"The salad could have been more okay, but overall it was mediocre.",3,Curry Delight,Chinese
The burger was absolutely poor. I would definitely come back again!,5,Casa Mexicana,Japanese
I found the burger to be fantastic. Ambience made it even better.,3,La Trattoria,American
The pasta was absolutely great. I would definitely come back again!,4,Spice Hub,Mexican
The ramen was absolutely fantastic. I would definitely come back again!,1,Sushi World,Italian
The sushi here is consistently okay. Highly recommend this spot.,3,Bella Italia,Mediterranean
"I loved the pizza here, it was so great.",5,Spice Hub,Chinese
Service was lobster and the average tasted wonderful.,1,Golden Dragon,Indian
"I loved the curry here, it was so fantastic.",5,Burger Joint,Seafood
Service was tacos and the outstanding tasted poor.,3,Bella Italia,Seafood
One of the best places for curry food! The dishes were wonderful.,3,Spice Hub,American
The burger here is consistently amazing. Highly recommend this spot.,3,Sushi World,Mexican
The tacos was absolutely okay. I would definitely come back again!,5,La Trattoria,Chinese
The ramen was absolutely outstanding. I would definitely come back again!,4,Sushi World,American
The sushi was absolutely fantastic. I would definitely come back again!,5,Curry Delight,Chinese
The tacos was absolutely average. I would definitely come back again!,4,Curry Delight,Chinese
The pasta was absolutely fantastic. I would definitely come back again!,5,Curry Delight,American
"The lobster could have been more okay, but overall it was mediocre.",5,Burger Joint,American
The steak was absolutely amazing. I would definitely come back again!,4,Bella Italia,Mexican
Service was lobster and the amazing tasted mediocre.,5,La Trattoria,Chinese
Service was tacos and the fantastic tasted mediocre.,1,Ocean Breeze,Mexican
The salad here is consistently poor. Highly recommend this spot.,2,Bella Italia,Mediterranean
One of the best places for tacos food! The dishes were great.,1,Casa Mexicana,American
Service was burger and the average tasted fantastic.,3,Ocean Breeze,Chinese
"I loved the burger here, it was so great.",1,Golden Dragon,American
The burger was absolutely amazing. I would definitely come back again!,3,Curry Delight,Italian
Service was pizza and the wonderful tasted amazing.,3,Casa Mexicana,Mexican
One of the best places for lobster food! The dishes were okay.,3,Spice Hub,Indian
"I loved the sushi here, it was so okay.",5,Grill Master,Chinese
One of the best places for tacos food! The dishes were mediocre.,4,Ocean Breeze,Seafood
I found the lobster to be amazing. Ambience made it even better.,4,La Trattoria,Chinese
"The lobster could have been more poor, but overall it was average.",3,Casa Mexicana,Japanese
"The steak could have been more delicious, but overall it was amazing.",4,Golden Dragon,Chinese
One of the best places for sushi food! The dishes were average.,4,La Trattoria,Japanese
One of the best places for pasta food! The dishes were delicious.,2,Curry Delight,Indian
The steak was absolutely poor. I would definitely come back again!,5,Grill Master,Seafood
"I loved the sushi here, it was so fantastic.",5,Bella Italia,Indian
"I loved the burger here, it was so poor.",5,Sushi World,Mexican
The steak was absolutely wonderful. I would definitely come back again!,4,Burger Joint,Seafood
The ramen was absolutely delicious. I would definitely come back again!,2,La Trattoria,Italian
"I loved the curry here, it was so okay.",5,Curry Delight,Mexican
The pizza here is consistently wonderful. Highly recommend this spot.,5,Bella Italia,Japanese
I found the ramen to be outstanding. Ambience made it even better.,2,Grill Master,Chinese
"I loved the sushi here, it was so mediocre.",4,Golden Dragon,Indian
"I loved the ramen here, it was so outstanding.",1,Bella Italia,Japanese
"The pasta could have been more poor, but overall it was outstanding.",1,La Trattoria,Chinese
The ramen was absolutely mediocre. I would definitely come back again!,1,Burger Joint,Chinese
The salad here is consistently average. Highly recommend this spot.,5,Burger Joint,Mexican
One of the best places for steak food! The dishes were average.,4,Grill Master,Chinese
"I loved the salad here, it was so poor.",5,Burger Joint,Seafood
Service was tacos and the mediocre tasted outstanding.,2,Ocean Breeze,Japanese
"The tacos could have been more wonderful, but overall it was great.",4,Ocean Breeze,Indian
The sushi here is consistently delicious. Highly recommend this spot.,5,Sushi World,American
"I loved the steak here, it was so mediocre.",2,Burger Joint,Seafood
Service was burger and the amazing tasted poor.,5,Ocean Breeze,Chinese
One of the best places for curry food! The dishes were great.,5,Sushi World,Mediterranean
The ramen here is consistently outstanding. Highly recommend this spot.,3,Bella Italia,Chinese
The curry here is consistently great. Highly recommend this spot.,5,Grill Master,Chinese
One of the best places for pasta food! The dishes were delicious.,5,La Trattoria,Chinese
One of the best places for salad food! The dishes were fantastic.,1,Spice Hub,Seafood
One of the best places for tacos food! The dishes were amazing.,5,Curry Delight,Mediterranean
"The tacos could have been more okay, but overall it was poor.",2,Ocean Breeze,American
"The pizza could have been more average, but overall it was fantastic.",3,La Trattoria,Seafood
Service was burger and the great tasted mediocre.,1,La Trattoria,Mediterranean
"I loved the steak here, it was so outstanding.",3,Spice Hub,Chinese
"The pizza could have been more average, but overall it was poor.",5,Sushi World,American
"The steak could have been more fantastic, but overall it was mediocre.",4,Grill Master,Indian
One of the best places for ramen food! The dishes were delicious.,5,Ocean Breeze,Mexican
Service was lobster and the great tasted mediocre.,3,La Trattoria,American
The steak here is consistently wonderful. Highly recommend this spot.,1,Sushi World,Indian
"The burger could have been more mediocre, but overall it was delicious.",5,Sushi World,Seafood
One of the best places for pasta food! The dishes were poor.,4,Burger Joint,Italian
The steak here is consistently delicious. Highly recommend this spot.,4,Sushi World,Mexican
The lobster was absolutely outstanding. I would definitely come back again!,4,Golden Dragon,Indian
"I loved the pizza here, it was so outstanding.",4,La Trattoria,Japanese
The pasta here is consistently outstanding. Highly recommend this spot.,1,Burger Joint,American
I found the burger to be wonderful. Ambience made it even better.,3,La Trattoria,Mexican
Service was pizza and the outstanding tasted poor.,1,Grill Master,Japanese
The curry was absolutely fantastic. I would definitely come back again!,2,Burger Joint,Mexican
"I loved the pasta here, it was so poor.",3,Grill Master,Japanese
Service was steak and the great tasted poor.,1,Burger Joint,Indian
The pizza here is consistently okay. Highly recommend this spot.,5,Burger Joint,Italian
Service was steak and the poor tasted wonderful.,2,La Trattoria,Italian
I found the lobster to be great. Ambience made it even better.,2,Casa Mexicana,Indian
The tacos here is consistently okay. Highly recommend this spot.,2,Golden Dragon,Seafood
I found the pizza to be great. Ambience made it even better.,4,Burger Joint,Chinese
"I loved the sushi here, it was so delicious.",5,Ocean Breeze,Indian
Service was pizza and the okay tasted delicious.,5,Curry Delight,Chinese
I found the steak to be fantastic. Ambience made it even better.,3,Curry Delight,Japanese
Service was salad and the great tasted delicious.,4,Bella Italia,Indian
Service was ramen and the amazing tasted okay.,5,Burger Joint,Seafood
"The ramen could have been more fantastic, but overall it was wonderful.",1,Casa Mexicana,Indian
"The pizza could have been more wonderful, but overall it was delicious.",1,Golden Dragon,Japanese
The ramen was absolutely fantastic. I would definitely come back again!,4,Casa Mexicana,Mediterranean
The lobster was absolutely delicious. I would definitely come back again!,1,Casa Mexicana,Indian
"The curry could have been more delicious, but overall it was average.",2,Grill Master,Seafood
The sushi was absolutely average. I would definitely come back again!,5,La Trattoria,Mediterranean
"I loved the lobster here, it was so outstanding.",1,Casa Mexicana,Mexican
"The salad could have been more delicious, but overall it was amazing.",2,Ocean Breeze,Mediterranean
The tacos was absolutely average. I would definitely come back again!,1,Ocean Breeze,Seafood
The steak was absolutely great. I would definitely come back again!,5,Burger Joint,Mexican
"The ramen could have been more outstanding, but overall it was great.",4,Golden Dragon,Mexican
One of the best places for sushi food! The dishes were okay.,1,La Trattoria,Mexican
The steak was absolutely poor. I would definitely come back again!,3,Spice Hub,Italian
"I loved the steak here, it was so okay.",4,Grill Master,Chinese
The curry here is consistently amazing. Highly recommend this spot.,3,Golden Dragon,Chinese
One of the best places for sushi food! The dishes were okay.,3,Ocean Breeze,American
I found the curry to be poor. Ambience made it even better.,5,Curry Delight,Italian
"I loved the salad here, it was so average.",2,Burger Joint,Mediterranean
Service was ramen and the wonderful tasted average.,1,Spice Hub,Mexican
I found the lobster to be average. Ambience made it even better.,4,Curry Delight,Indian
The tacos here is consistently amazing. Highly recommend this spot.,2,Burger Joint,Indian
The steak here is consistently outstanding. Highly recommend this spot.,2,La Trattoria,Indian
Service was ramen and the mediocre tasted wonderful.,3,Grill Master,Japanese
Service was sushi and the great tasted amazing.,3,Grill Master,American
"I loved the ramen here, it was so wonderful.",2,La Trattoria,Chinese
Service was lobster and the great tasted delicious.,1,La Trattoria,Japanese
I found the pasta to be wonderful. Ambience made it even better.,4,Bella Italia,Italian
Service was pasta and the great tasted amazing.,2,Ocean Breeze,Italian
The sushi was absolutely great. I would definitely come back again!,4,La Trattoria,Seafood
