review_text,rating,restaurant_name,cuisine_type
"The salad could have been more outstanding, but overall it was amazing.",2,Ocean Breeze,Indian
Service was ramen and the delicious tasted wonderful.,3,Bella Italia,Indian
Service was steak and the outstanding tasted poor.,3,Ocean Breeze,Mediterranean
I found the pasta to be fantastic. Ambience made it even better.,2,La Trattoria,Chinese
Service was ramen and the delicious tasted amazing.,3,Casa Mexicana,Japanese
The tacos here is consistently wonderful. Highly recommend this spot.,2,Ocean Breeze,Mexican
One of the best places for pizza food! The dishes were amazing.,1,Casa Mexicana,Chinese
Service was pizza and the great tasted delicious.,1,Bella Italia,American
One of the best places for curry food! The dishes were okay.,1,Sushi World,American
Service was pasta and the outstanding tasted wonderful.,1,Grill Master,Italian
The tacos was absolutely wonderful. I would definitely come back again!,1,Sushi World,Mediterranean
The pizza was absolutely okay. I would definitely come back again!,5,Bella Italia,Japanese
The lobster here is consistently wonderful. Highly recommend this spot.,3,La Trattoria,Mexican
I found the burger to be amazing. Ambience made it even better.,5,Burger Joint,Mexican
One of the best places for curry food! The dishes were mediocre.,3,Ocean Breeze,Seafood
"The burger could have been more mediocre, but overall it was okay.",2,La Trattoria,Indian
I found the salad to be wonderful. Ambience made it even better.,4,Golden Dragon,Seafood
The tacos was absolutely great. I would definitely come back again!,1,La Trattoria,Japanese
The tacos was absolutely amazing. I would definitely come back again!,4,Sushi World,Mexican
The pasta was absolutely mediocre. I would definitely come back again!,1,Spice Hub,Chinese
One of the best places for ramen food! The dishes were okay.,4,Bella Italia,Italian
The burger here is consistently okay. Highly recommend this spot.,3,Casa Mexicana,Mediterranean
"I loved the curry here, it was so delicious.",2,Spice Hub,Mexican
I found the ramen to be fantastic. Ambience made it even better.,2,Golden Dragon,Indian
"The salad could have been more great, but overall it was delicious.",1,Curry Delight,Italian
One of the best places for curry food! The dishes were poor.,5,Ocean Breeze,Mexican
"I loved the sushi here, it was so average.",5,Ocean Breeze,Italian
"The tacos could have been more wonderful, but overall it was poor.",4,Bella Italia,Mexican
"The burger could have been more fantastic, but overall it was great.",2,Spice Hub,American
"The sushi could have been more amazing, but overall it was delicious.",2,Bella Italia,Indian
"I loved the ramen here, it was so average.",4,Spice Hub,Mediterranean
"The pasta could have been more amazing, but overall it was delicious.",4,Curry Delight,Indian
Service was steak and the outstanding tasted poor.,2,La Trattoria,Chinese
The pizza here is consistently fantastic. Highly recommend this spot.,1,Sushi World,Seafood
Service was tacos and the mediocre tasted wonderful.,3,Grill Master,Mexican
Service was ramen and the great tasted wonderful.,4,Casa Mexicana,Mediterranean
One of the best places for tacos food! The dishes were poor.,5,Burger Joint,Chinese
"The sushi could have been more delicious, but overall it was amazing.",3,Sushi World,Chinese
The ramen was absolutely amazing. I would definitely come back again!,5,Curry Delight,Seafood
"The lobster could have been more delicious, but overall it was okay.",5,Spice Hub,Italian
The salad here is consistently outstanding. Highly recommend this spot.,2,Casa Mexicana,Mediterranean
The tacos here is consistently amazing. Highly recommend this spot.,1,Grill Master,Seafood
The burger was absolutely wonderful. I would definitely come back again!,1,Golden Dragon,Chinese
"The burger could have been more outstanding, but overall it was average.",4,La Trattoria,Mediterranean
"The pasta could have been more great, but overall it was fantastic.",3,Sushi World,Mexican
"The pasta could have been more poor, but overall it was average.",2,Casa Mexicana,Indian
The ramen here is consistently okay. Highly recommend this spot.,4,La Trattoria,Japanese
I found the sushi to be mediocre. Ambience made it even better.,5,Casa Mexicana,American
"I loved the steak here, it was so amazing.",4,Ocean Breeze,Indian
Service was pasta and the delicious tasted outstanding.,2,Golden Dragon,Mexican
The steak was absolutely average. I would definitely come back again!,2,Bella Italia,Indian
I found the ramen to be poor. Ambience made it even better.,3,La Trattoria,Mediterranean
I found the sushi to be great. Ambience made it even better.,2,Sushi World,Italian
I found the burger to be okay. Ambience made it even better.,1,Spice Hub,Italian
I found the burger to be fantastic. Ambience made it even better.,3,Spice Hub,Mediterranean
Service was ramen and the outstanding tasted mediocre.,5,Sushi World,Italian
The sushi was absolutely delicious. I would definitely come back again!,2,Curry Delight,American
The pizza here is consistently okay. Highly recommend this spot.,4,Casa Mexicana,American
The sushi was absolutely mediocre. I would definitely come back again!,1,Spice Hub,American
"The curry could have been more outstanding, but overall it was average.",3,Burger Joint,American
I found the pasta to be fantastic. Ambience made it even better.,4,Bella Italia,Japanese
I found the sushi to be great. Ambience made it even better.,1,Spice Hub,Chinese
I found the salad to be mediocre. Ambience made it even better.,4,Sushi World,Mexican
I found the pasta to be mediocre. Ambience made it even better.,2,Spice Hub,Italian
The sushi here is consistently poor. Highly recommend this spot.,5,Bella Italia,Italian
"I loved the ramen here, it was so outstanding.",3,Sushi World,American
I found the steak to be poor. Ambience made it even better.,2,Spice Hub,Seafood
"The lobster could have been more okay, but overall it was outstanding.",1,La Trattoria,Mexican
Service was salad and the outstanding tasted mediocre.,1,Curry Delight,Japanese
"I loved the burger here, it was so outstanding.",1,Spice Hub,Chinese
The sushi here is consistently wonderful. Highly recommend this spot.,1,Ocean Breeze,Italian
The lobster was absolutely okay. I would definitely come back again!,2,Spice Hub,Chinese
Service was ramen and the amazing tasted delicious.,2,Sushi World,Mediterranean
"The ramen could have been more great, but overall it was delicious.",1,La Trattoria,Japanese
The tacos here is consistently delicious. Highly recommend this spot.,3,Ocean Breeze,Indian
The curry was absolutely wonderful. I would definitely come back again!,4,Golden Dragon,Seafood
The sushi here is consistently poor. Highly recommend this spot.,1,Curry Delight,Chinese
One of the best places for ramen food! The dishes were mediocre.,5,La Trattoria,Seafood
One of the best places for sushi food! The dishes were great.,2,Curry Delight,Seafood
"The steak could have been more amazing, but overall it was average.",1,Ocean Breeze,Italian
One of the best places for sushi food! The dishes were wonderful.,3,Bella Italia,Seafood
The pizza here is consistently great. Highly recommend this spot.,3,Burger Joint,Chinese
The burger was absolutely wonderful. I would definitely come back again!,4,Burger Joint,Seafood
"I loved the steak here, it was so fantastic.",5,Ocean Breeze,Seafood
Service was curry and the great tasted okay.,4,Grill Master,Mediterranean
One of the best places for curry food! The dishes were fantastic.,3,Grill Master,Japanese
The salad was absolutely delicious. I would definitely come back again!,5,Golden Dragon,Japanese
I found the burger to be amazing. Ambience made it even better.,3,Golden Dragon,Italian
One of the best places for sushi food! The dishes were amazing.,2,Casa Mexicana,Japanese
"I loved the burger here, it was so average.",1,Spice Hub,Mexican
I found the burger to be poor. Ambience made it even better.,3,Grill Master,Mediterranean
Service was sushi and the amazing tasted outstanding.,3,Spice Hub,Japanese
One of the best places for lobster food! The dishes were okay.,5,Sushi World,Indian
"The pizza could have been more okay, but overall it was average.",1,Bella Italia,Seafood
"I loved the curry here, it was so outstanding.",5,Grill Master,Indian
The burger here is consistently delicious. Highly recommend this spot.,1,La Trattoria,Chinese
I found the lobster to be amazing. Ambience made it even better.,1,Bella Italia,Chinese
"The tacos could have been more poor, but overall it was average.",4,Burger Joint,Mediterranean
The burger here is consistently average. Highly recommend this spot.,5,Curry Delight,Mediterranean
One of the best places for curry food! The dishes were delicious.,2,Casa Mexicana,Chinese
I found the lobster to be great. Ambience made it even better.,1,Sushi World,American
Service was sushi and the amazing tasted wonderful.,1,Curry Delight,Italian
"The burger could have been more amazing, but overall it was delicious.",4,Sushi World,American
"I loved the lobster here, it was so average.",4,Bella Italia,Chinese
"I loved the sushi here, it was so okay.",4,Grill Master,Mediterranean
One of the best places for steak food! The dishes were delicious.,1,Spice Hub,American
The salad here is consistently poor. Highly recommend this spot.,1,Curry Delight,American
The salad was absolutely mediocre. I would definitely come back again!,5,La Trattoria,Chinese
The pizza was absolutely amazing. I would definitely come back again!,4,Casa Mexicana,Chinese
"The pasta could have been more great, but overall it was outstanding.",4,Burger Joint,Seafood
Service was sushi and the okay tasted amazing.,2,Curry Delight,Indian
I found the tacos to be outstanding. Ambience made it even better.,2,Grill Master,Chinese
I found the curry to be great. Ambience made it even better.,2,Curry Delight,Italian
"I loved the salad here, it was so outstanding.",5,Casa Mexicana,Italian
The curry was absolutely amazing. I would definitely come back again!,1,Ocean Breeze,Mediterranean
The ramen was absolutely mediocre. I would definitely come back again!,5,Bella Italia,Mexican
"I loved the burger here, it was so great.",4,Grill Master,Indian
The burger was absolutely outstanding. I would definitely come back again!,3,Spice Hub,Mexican
The steak was absolutely poor. I would definitely come back again!,5,Spice Hub,American
Service was burger and the okay tasted delicious.,5,Burger Joint,Indian
The sushi here is consistently outstanding. Highly recommend this spot.,5,Sushi World,Chinese
The curry was absolutely outstanding. I would definitely come back again!,4,Casa Mexicana,Mexican
The burger here is consistently outstanding. Highly recommend this spot.,3,Sushi World,American
Service was pizza and the amazing tasted mediocre.,5,Bella Italia,Italian
I found the tacos to be great. Ambience made it even better.,3,Ocean Breeze,Chinese
Service was salad and the delicious tasted outstanding.,5,Curry Delight,Italian
"The steak could have been more okay, but overall it was mediocre.",1,Grill Master,Chinese
I found the ramen to be mediocre. Ambience made it even better.,1,Bella Italia,Mediterranean
"I loved the curry here, it was so average.",4,Burger Joint,Mediterranean
Service was steak and the amazing tasted mediocre.,1,Bella Italia,Chinese
The sushi here is consistently average. Highly recommend this spot.,4,Golden Dragon,American
The sushi was absolutely delicious. I would definitely come back again!,4,Curry Delight,Mediterranean
"The tacos could have been more wonderful, but overall it was fantastic.",4,Sushi World,Japanese
The lobster was absolutely delicious. I would definitely come back again!,3,Ocean Breeze,Mexican
"I loved the pizza here, it was so amazing.",1,Curry Delight,Mexican
The burger was absolutely fantastic. I would definitely come back again!,5,Ocean Breeze,Mediterranean
One of the best places for salad food! The dishes were poor.,2,Spice Hub,American
Service was salad and the outstanding tasted mediocre.,1,Grill Master,Seafood
"The pasta could have been more delicious, but overall it was average.",4,Burger Joint,Seafood
The salad here is consistently average. Highly recommend this spot.,3,Casa Mexicana,American
One of the best places for lobster food! The dishes were average.,5,Bella Italia,American
The ramen was absolutely okay. I would definitely come back again!,2,Curry Delight,Japanese
One of the best places for burger food! The dishes were great.,2,Casa Mexicana,Indian
"The pasta could have been more poor, but overall it was okay.",5,Curry Delight,American
Service was ramen and the wonderful tasted outstanding.,4,Bella Italia,Mexican
"The pasta could have been more mediocre, but overall it was amazing.",3,La Trattoria,Chinese
"The burger could have been more wonderful, but overall it was amazing.",5,Burger Joint,Indian
"The pizza could have been more poor, but overall it was outstanding.",5,Golden Dragon,Italian
The sushi here is consistently delicious. Highly recommend this spot.,3,Curry Delight,Chinese
"The ramen could have been more mediocre, but overall it was great.",4,Sushi World,American
I found the steak to be great. Ambience made it even better.,5,Burger Joint,Japanese
One of the best places for tacos food! The dishes were wonderful.,2,Grill Master,Mediterranean
Service was salad and the average tasted delicious.,5,Curry Delight,American
I found the pizza to be wonderful. Ambience made it even better.,5,Spice Hub,Chinese
One of the best places for tacos food! The dishes were great.,1,Casa Mexicana,Italian
"The burger could have been more amazing, but overall it was outstanding.",3,La Trattoria,Mexican
"The pizza could have been more amazing, but overall it was average.",4,Spice Hub,Indian
The salad was absolutely okay. I would definitely come back again!,1,Ocean Breeze,Mediterranean
One of the best places for curry food! The dishes were delicious.,2,Ocean Breeze,Indian
The pizza here is consistently fantastic. Highly recommend this spot.,4,La Trattoria,Italian
Service was steak and the mediocre tasted great.,4,La Trattoria,Indian
One of the best places for tacos food! The dishes were wonderful.,3,Burger Joint,Japanese
"I loved the pasta here, it was so poor.",4,Curry Delight,Mediterranean
I found the pizza to be wonderful. Ambience made it even better.,3,Burger Joint,Japanese
The tacos here is consistently delicious. Highly recommend this spot.,5,Curry Delight,Mexican
I found the curry to be fantastic. Ambience made it even better.,3,La Trattoria,Seafood
The lobster here is consistently wonderful. Highly recommend this spot.,5,Ocean Breeze,Chinese
"I loved the sushi here, it was so wonderful.",3,Golden Dragon,Seafood
"The ramen could have been more outstanding, but overall it was mediocre.",3,Spice Hub,Mediterranean
One of the best places for tacos food! The dishes were delicious.,3,Curry Delight,Mediterranean
Service was burger and the wonderful tasted great.,3,Bella Italia,Italian
One of the best places for tacos food! The dishes were delicious.,4,Bella Italia,Japanese
Service was steak and the outstanding tasted fantastic.,2,Casa Mexicana,Mediterranean
The pasta was absolutely outstanding. I would definitely come back again!,3,Casa Mexicana,Japanese
Service was sushi and the fantastic tasted poor.,4,Burger Joint,Mediterranean
The lobster here is consistently delicious. Highly recommend this spot.,2,Sushi World,Japanese
The pasta here is consistently mediocre. Highly recommend this spot.,4,Casa Mexicana,Chinese
"I loved the pasta here, it was so okay.",5,Curry Delight,Japanese
The sushi was absolutely delicious. I would definitely come back again!,3,Golden Dragon,Mediterranean
The steak here is consistently delicious. Highly recommend this spot.,5,Bella Italia,Mexican
"The burger could have been more wonderful, but overall it was amazing.",5,Casa Mexicana,Mexican
"The curry could have been more poor, but overall it was delicious.",2,Spice Hub,Mexican
One of the best places for sushi food! The dishes were fantastic.,4,La Trattoria,Japanese
I found the lobster to be amazing. Ambience made it even better.,5,Casa Mexicana,Mexican
"The ramen could have been more delicious, but overall it was okay.",1,La Trattoria,Indian
Service was pasta and the wonderful tasted average.,5,Curry Delight,Mediterranean
The burger here is consistently okay. Highly recommend this spot.,1,Curry Delight,Mediterranean
Service was sushi and the amazing tasted outstanding.,1,Curry Delight,Seafood
I found the tacos to be fantastic. Ambience made it even better.,4,Casa Mexicana,Japanese
Service was burger and the great tasted wonderful.,4,Grill Master,Mediterranean
One of the best places for steak food! The dishes were fantastic.,3,La Trattoria,Mexican
The burger here is consistently poor. Highly recommend this spot.,2,Grill Master,Japanese
The pizza here is consistently amazing. Highly recommend this spot.,2,Bella Italia,Italian
The burger was absolutely outstanding. I would definitely come back again!,1,Curry Delight,Mediterranean
I found the pasta to be poor. Ambience made it even better.,3,Ocean Breeze,Chinese
The curry here is consistently outstanding. Highly recommend this spot.,4,Golden Dragon,Seafood
The sushi was absolutely outstanding. I would definitely come back again!,4,Golden Dragon,Japanese
"The burger could have been more average, but overall it was fantastic.",3,Golden Dragon,Indian
Service was sushi and the great tasted fantastic.,4,Golden Dragon,Mediterranean
One of the best places for lobster food! The dishes were fantastic.,1,Curry Delight,Italian
I found the salad to be mediocre. Ambience made it even better.,4,Grill Master,Japanese
Service was pasta and the mediocre tasted great.,4,La Trattoria,American
"I loved the salad here, it was so okay.",1,Casa Mexicana,Chinese
"The burger could have been more okay, but overall it was wonderful.",1,Golden Dragon,Italian
Service was salad and the wonderful tasted delicious.,4,Bella Italia,Chinese
"I loved the salad here, it was so fantastic.",2,Burger Joint,Chinese
"The burger could have been more amazing, but overall it was fantastic.",4,Burger Joint,Mediterranean
Service was salad and the wonderful tasted average.,2,Bella Italia,Mexican
The lobster here is consistently wonderful. Highly recommend this spot.,5,Casa Mexicana,Japanese
"The tacos could have been more great, but overall it was okay.",5,Spice Hub,Indian
The steak was absolutely average. I would definitely come back again!,2,Bella Italia,Japanese
The tacos was absolutely mediocre. I would definitely come back again!,4,Spice Hub,Mexican
The tacos here is consistently amazing. Highly recommend this spot.,3,Bella Italia,Indian
I found the sushi to be fantastic. Ambience made it even better.,3,Grill Master,Japanese
The lobster was absolutely poor. I would definitely come back again!,5,Bella Italia,Chinese
"I loved the lobster here, it was so outstanding.",3,Bella Italia,Chinese
The tacos here is consistently amazing. Highly recommend this spot.,5,La Trattoria,Japanese
I found the lobster to be average. Ambience made it even better.,5,Spice Hub,Japanese
"I loved the steak here, it was so outstanding.",2,Sushi World,Chinese
I found the pasta to be delicious. Ambience made it even better.,3,Curry Delight,Japanese
Service was sushi and the amazing tasted okay.,2,Grill Master,Seafood
I found the pasta to be okay. Ambience made it even better.,4,Bella Italia,Seafood
I found the curry to be outstanding. Ambience made it even better.,2,Golden Dragon,Italian
"The ramen could have been more delicious, but overall it was great.",4,La Trattoria,Seafood
The pasta here is consistently okay. Highly recommend this spot.,3,Curry Delight,Chinese
One of the best places for steak food! The dishes were wonderful.,3,Burger Joint,Seafood
"I loved the steak here, it was so poor.",4,Burger Joint,Mexican
Service was tacos and the average tasted delicious.,5,Spice Hub,Mexican
The salad here is consistently okay. Highly recommend this spot.,1,Ocean Breeze,Chinese
The pasta was absolutely poor. I would definitely come back again!,4,Casa Mexicana,American
"The burger could have been more great, but overall it was okay.",3,La Trattoria,American
The salad here is consistently average. Highly recommend this spot.,1,Bella Italia,American
"I loved the lobster here, it was so fantastic.",2,Curry Delight,Japanese
"I loved the lobster here, it was so fantastic.",5,Burger Joint,Mexican
"I loved the burger here, it was so fantastic.",1,Sushi World,Indian
"The sushi could have been more great, but overall it was mediocre.",3,Sushi World,Chinese
"The pasta could have been more wonderful, but overall it was mediocre.",1,Bella Italia,Chinese
"I loved the ramen here, it was so okay.",5,Golden Dragon,Chinese
The steak was absolutely great. I would definitely come back again!,4,Burger Joint,Indian
I found the burger to be outstanding. Ambience made it even better.,3,Ocean Breeze,Chinese
I found the burger to be delicious. Ambience made it even better.,3,Golden Dragon,Japanese
Service was tacos and the wonderful tasted outstanding.,2,Grill Master,Indian
The salad was absolutely outstanding. I would definitely come back again!,1,Sushi World,Japanese
Service was tacos and the outstanding tasted okay.,1,Sushi World,Seafood
"I loved the ramen here, it was so average.",3,La Trattoria,Mexican
"The pizza could have been more okay, but overall it was average.",5,Spice Hub,Indian
One of the best places for pizza food! The dishes were wonderful.,3,Bella Italia,Mexican
The salad was absolutely poor. I would definitely come back again!,1,Bella Italia,Mexican
The curry here is consistently mediocre. Highly recommend this spot.,1,Sushi World,Seafood
"The tacos could have been more mediocre, but overall it was delicious.",3,Curry Delight,Italian
The pizza was absolutely delicious. I would definitely come back again!,2,La Trattoria,Indian
One of the best places for pasta food! The dishes were mediocre.,5,Bella Italia,Seafood
One of the best places for burger food! The dishes were mediocre.,2,Grill Master,Japanese
The tacos here is consistently fantastic. Highly recommend this spot.,3,Spice Hub,Seafood
Service was steak and the delicious tasted average.,3,Spice Hub,Chinese
"The burger could have been more amazing, but overall it was wonderful.",1,Casa Mexicana,American
I found the salad to be okay. Ambience made it even better.,2,Grill Master,Mediterranean
Service was curry and the average tasted outstanding.,4,Casa Mexicana,American
"I loved the pizza here, it was so average.",4,Grill Master,Indian
The sushi here is consistently delicious. Highly recommend this spot.,3,Spice Hub,Indian
Service was tacos and the average tasted great.,4,Golden Dragon,Mediterranean
Service was pasta and the wonderful tasted fantastic.,1,Curry Delight,Seafood
One of the best places for steak food! The dishes were mediocre.,3,Ocean Breeze,Indian
"The sushi could have been more great, but overall it was wonderful.",5,Grill Master,Italian
One of the best places for pasta food! The dishes were average.,5,Sushi World,Mexican
"I loved the pizza here, it was so wonderful.",1,Casa Mexicana,American
The ramen here is consistently okay. Highly recommend this spot.,1,Bella Italia,Italian
Service was burger and the outstanding tasted mediocre.,3,Burger Joint,Chinese
Service was ramen and the amazing tasted delicious.,2,Ocean Breeze,Italian
"I loved the pasta here, it was so wonderful.",4,Golden Dragon,Chinese
"The lobster could have been more amazing, but overall it was great.",1,La Trattoria,Chinese
The sushi was absolutely delicious. I would definitely come back again!,5,Curry Delight,Indian
Service was sushi and the poor tasted great.,4,Grill Master,Mediterranean
I found the salad to be wonderful. Ambience made it even better.,5,La Trattoria,Indian
The ramen here is consistently poor. Highly recommend this spot.,3,Ocean Breeze,Mexican
"The pasta could have been more fantastic, but overall it was wonderful.",3,Ocean Breeze,Japanese
The steak was absolutely average. I would definitely come back again!,3,Spice Hub,Chinese
The pizza here is consistently amazing. Highly recommend this spot.,5,Golden Dragon,Japanese
"I loved the ramen here, it was so delicious.",1,Golden Dragon,Indian
"I loved the sushi here, it was so okay.",3,Casa Mexicana,Chinese
One of the best places for curry food! The dishes were average.,5,Ocean Breeze,Italian
"I loved the steak here, it was so okay.",5,Grill Master,Seafood
"The tacos could have been more amazing, but overall it was average.",2,Golden Dragon,Italian
The curry here is consistently amazing. Highly recommend this spot.,4,Spice Hub,Japanese
I found the ramen to be outstanding. Ambience made it even better.,5,Curry Delight,Mediterranean
The sushi here is consistently fantastic. Highly recommend this spot.,2,Curry Delight,Mediterranean
The pasta was absolutely fantastic. I would definitely come back again!,1,Bella Italia,Mediterranean
One of the best places for lobster food! The dishes were delicious.,3,Grill Master,Japanese
Service was salad and the outstanding tasted wonderful.,1,Golden Dragon,Mexican
"I loved the sushi here, it was so poor.",2,Burger Joint,Japanese
The lobster was absolutely fantastic. I would definitely come back again!,4,Spice Hub,Italian
The burger was absolutely average. I would definitely come back again!,1,La Trattoria,American
The salad was absolutely amazing. I would definitely come back again!,3,Ocean Breeze,Japanese
I found the pizza to be amazing. Ambience made it even better.,2,Bella Italia,American
The burger was absolutely okay. I would definitely come back again!,4,Spice Hub,Italian
"The tacos could have been more outstanding, but overall it was wonderful.",4,Bella Italia,Japanese
Service was ramen and the poor tasted average.,2,Casa Mexicana,Chinese
The salad here is consistently fantastic. Highly recommend this spot.,1,Casa Mexicana,Mediterranean
"The salad could have been more okay, but overall it was amazing.",4,Curry Delight,Japanese
